<?xml version="1.0" encoding="UTF-8"?>
<xs:schema xmlns:xs="http://www.w3.org/2001/XMLSchema">
	<xs:element name="list">
		<xs:complexType>
			<xs:sequence minOccurs="1" maxOccurs="unbounded">
				<xs:element name="skill" minOccurs="1" maxOccurs="unbounded">
					<xs:complexType>
						<xs:sequence minOccurs="1" maxOccurs="unbounded">
							<xs:element name="remove" minOccurs="1" maxOccurs="unbounded">
								<xs:complexType>
									<xs:attribute name="id" type="xs:positiveInteger" use="required" />
								</xs:complexType>
							</xs:element>
						</xs:sequence>
						<xs:attribute name="id" type="xs:positiveInteger" use="required" />
					</xs:complexType>
				</xs:element>
			</xs:sequence>
		</xs:complexType>
	</xs:element>
</xs:schema>						